[
  {
    "id": "artsvuni-com",
    "url": "https://artsvuni.com",
    "captured_at": "2026-04-19",
    "direction": {
      "one_liner": "Humble brutalist designer portfolio: raw document aesthetic with one typographic in-joke",
      "tags": [
        "brutalist",
        "portfolio",
        "raw",
        "personal",
        "typographic",
        "document-like",
        "framer"
      ]
    },
    "typography": {
      "display": {
        "family": "Distinctive grotesk with monospace leanings — reads like GT America Mono or a similar industrial face",
        "weights": [
          400,
          600
        ],
        "features": [
          "diacritics used as ornament ('Intêrnatiønal Cømmęrče')",
          "moderate size — H2 scale, not oversized hero",
          "sentence-case throughout"
        ],
        "note": "The author explicitly cites \"humble brutalist architecture\" as an influence.\nThe type choice follows: geometric, plain, no flourishes, but a single\ndeliberate deformation — accented characters — acts as the signature.\n"
      },
      "body": {
        "family": "Neutral sans, slightly tight leading",
        "weights": [
          400
        ]
      },
      "scale_contrast": "moderate",
      "notes": "The page behaves like a document, not a landing page. Paragraphs flow with\nsoft line breaks. Inline links sit inside sentences. This is a CV rendered\nas a webpage, not a marketing site dressed as a CV.\n"
    },
    "color": {
      "mode": "light",
      "background": "#FFFFFF",
      "foreground": "#111111",
      "accents": [
        {
          "name": "link-blue",
          "hex": "#0000EE",
          "role": "inline links, underlined, near-browser-default"
        }
      ],
      "palette_strategy": "Zero chrome. Black on white plus one functional link color. All visual energy\nis displaced onto the embedded media (GIFs and MP4s of real product work),\nwhich is where credibility lives in a designer portfolio anyway.\n"
    },
    "layout": {
      "grid": "single-column",
      "density": "moderate",
      "signature_moves": [
        "Full-bleed GIFs and MP4s of real shipped product work (Instagram Shops localization, Farfetch navigation)",
        "Case studies written as short paragraphs — role, scope, outcome in one breath",
        "Long tiled strip of album covers at the bottom as a personal signal",
        "Email address as the primary CTA via mailto: link"
      ]
    },
    "motion": {
      "philosophy": "minimal",
      "techniques": [
        "autoplaying GIFs and inline video carry the demonstration",
        "no scroll orchestration, no reveal animations"
      ],
      "library_guess": "Framer (native — no custom motion)"
    },
    "texture": {
      "backgrounds": [
        "pure white"
      ],
      "depth": "flat"
    },
    "signature_detail": "The typographic in-joke in the section title \"Intêrnatiønal Cømmęrče\" —\nextensive diacritics scattered across the word. It is simultaneously a visual\nornament and a direct commentary on the case study's subject (localization\nacross languages and scripts). It is the only decorative element on the\nentire site, and because it is the only one, it functions as the author's\nsignature.\n",
    "stack_guess": {
      "framework": "Framer",
      "evidence": "All asset URLs route through framerusercontent.com. The duplicated HTML blocks in the source correspond to Framer's responsive breakpoint rendering.",
      "confidence": "very high"
    },
    "applicability": {
      "works_for": [
        "Personal portfolios of designers, engineers, or technical writers",
        "Independent consultants or senior ICs whose work should speak for itself",
        "CV-style pages where credibility outweighs conversion"
      ],
      "avoid_for": [
        "Product marketing sites — no conversion rhythm",
        "Teams that need to signal scale and stack",
        "Contexts where 'professional' is equated with 'polished'"
      ]
    },
    "design_tokens": [
      {
        "token": "--bg",
        "value": "#FFFFFF"
      },
      {
        "token": "--fg",
        "value": "#111111"
      },
      {
        "token": "--link",
        "value": "#0000EE"
      },
      {
        "token": "font-display",
        "value": "\"GT America Mono\", \"JetBrains Mono\", ui-monospace, monospace"
      },
      {
        "token": "font-body",
        "value": "system-ui, -apple-system, sans-serif"
      },
      {
        "token": "--measure",
        "value": "60ch"
      },
      {
        "token": "--gap-between-cases",
        "value": "6rem"
      }
    ],
    "notes": "This is the antithesis of Crusoe and DCVC. Those sites construct institutional\nauthority. This one constructs personal credibility — and does so precisely\nby refusing to package itself as an agency would.\n\nCore lesson: if you build a personal site, do not imitate agency polish.\nStay at the document level, let the work embed directly, and add exactly one\ntypographic signature somewhere unexpected. The restraint is what reads as\nconfidence.\n"
  },
  {
    "id": "crusoe-ai",
    "url": "https://www.crusoe.ai",
    "captured_at": "2026-04-19",
    "direction": {
      "one_liner": "Industrial-editorial infrastructure: isometric SVG over white with a single electric-yellow punctuation mark",
      "tags": [
        "industrial",
        "editorial",
        "infra-tech",
        "light",
        "illustrative",
        "corporate-serious",
        "b2b"
      ]
    },
    "typography": {
      "display": {
        "family": "Custom geometric sans, condensed proportions (reads as bespoke or licensed — not system)",
        "weights": [
          500,
          600
        ],
        "features": [
          "tight tracking at display sizes",
          "hero headlines clamp from ~48px to ~120px",
          "sentence-case, no all-caps"
        ],
        "note": "The headline typeface is the first signal of budget and seriousness; it is clearly not a free Google font."
      },
      "body": {
        "family": "Neutral geometric sans",
        "weights": [
          400,
          500
        ]
      },
      "scale_contrast": "high",
      "notes": "Hero headlines do the heavy lifting. Body copy stays small, technical, almost\ndatasheet-like. The contrast between a 100px headline and 14px caption is the\nrhythm of the whole page.\n"
    },
    "color": {
      "mode": "light",
      "background": "#FFFFFF",
      "foreground": "#0A0A0A",
      "accents": [
        {
          "name": "signal-yellow",
          "hex": "#E8FF00",
          "role": "single sharp accent — square dots, highlights inside illustrations, cursor for key CTAs"
        },
        {
          "name": "section-grey",
          "hex": "#F2F2F2",
          "role": "soft background for alternating sections"
        }
      ],
      "palette_strategy": "Dominant black-on-white with one electric accent used as punctuation, not area.\nIf the yellow were deployed as a background fill anywhere the whole composition\nwould collapse into dev-tool cliche. The discipline is the design.\n"
    },
    "layout": {
      "grid": "12col with large hero blocks and numbered (01–04) stacked product sections",
      "density": "generous",
      "signature_moves": [
        "Numbered sections (01 Managed AI / 02 Cloud / 03 Data Centers / 04 Energy) that scroll-reveal vertically, turning a broad stack into a narrative",
        "Isometric SVG illustrations of data centers, microgrids, and server racks instead of stock renders",
        "Full-width logo carousel with high-signal customers (Cursor, Windsurf, HeyGen)",
        "Sticky headers that swap the adjacent illustration as you scroll"
      ]
    },
    "motion": {
      "philosophy": "restrained",
      "techniques": [
        "scroll-triggered reveals of numbered sections",
        "sticky title swaps illustration as user scrolls past",
        "infinite horizontal logo marquee",
        "carousel of model chips with prev/next arrows"
      ],
      "library_guess": "Webflow native interactions, likely with a GSAP ScrollTrigger layer"
    },
    "texture": {
      "backgrounds": [
        "flat white as dominant ground",
        "muted grey as the only section break",
        "photographic avatars only inside testimonial cards"
      ],
      "depth": "layered"
    },
    "signature_detail": "The isometric SVG illustrations with yellow square accents. They communicate\n\"we operate physical infrastructure\" without a single stock photo, and the\nnumbered 01–04 rhythm converts a four-product portfolio into a single vertical\nnarrative. Nothing else on the page is louder than the illustration, and the\nillustration itself is monochrome except for the yellow squares — which is\nexactly why the yellow reads as voltage.\n",
    "stack_guess": {
      "framework": "Webflow",
      "evidence": "Asset CDN paths use website-files.com and prod.website-files.com — Webflow's signature asset pipeline. Asset IDs follow Webflow's hash naming pattern.",
      "confidence": "very high"
    },
    "applicability": {
      "works_for": [
        "B2B infrastructure and developer-platform companies with enterprise buyers",
        "Hardware-adjacent or deep-tech companies that need to feel solid",
        "Companies with a portfolio of 3–5 products (numbered narrative works)",
        "Series C+ stage where restraint reads as confidence"
      ],
      "avoid_for": [
        "Consumer products that need warmth or personality",
        "Early-stage scrappy startups — this aesthetic reads as institutional",
        "Single-product companies (the numbered-stack move has nothing to chew on)"
      ]
    },
    "design_tokens": [
      {
        "token": "--bg",
        "value": "#FFFFFF"
      },
      {
        "token": "--fg",
        "value": "#0A0A0A"
      },
      {
        "token": "--accent-signal",
        "value": "#E8FF00"
      },
      {